{
  "$schema": "https://json-schema.org/draft/2020-12/schema",
  "type": "object",
  "additionalProperties": false,
  "required": [
    "schema_version",
    "reviewed_at",
    "review_method",
    "cases"
  ],
  "properties": {
    "schema_version": {
      "const": 1
    },
    "reviewed_at": {
      "type": "string",
      "format": "date"
    },
    "review_method": {
      "type": "string",
      "minLength": 1
    },
    "cases": {
      "type": "array",
      "maxItems": 100,
      "items": {
        "type": "object",
        "additionalProperties": false,
        "required": [
          "id",
          "vendor",
          "cve_ids",
          "product_pattern",
          "product_scope",
          "question",
          "advisory_urls",
          "release_source_leads",
          "research_record",
          "missing_evidence",
          "alternative_explanations"
        ],
        "properties": {
          "id": {
            "type": "string",
            "pattern": "^[a-z0-9-]+$"
          },
          "vendor": {
            "type": "string",
            "minLength": 1
          },
          "cve_ids": {
            "type": "array",
            "minItems": 1,
            "uniqueItems": true,
            "items": {
              "type": "string",
              "pattern": "^CVE-[0-9]{4}-[0-9]{4,}$"
            }
          },
          "product_pattern": {
            "type": "string",
            "minLength": 1
          },
          "product_scope": {
            "type": "string",
            "minLength": 1
          },
          "question": {
            "type": "string",
            "minLength": 1
          },
          "advisory_urls": {
            "type": "array",
            "minItems": 1,
            "items": {
              "type": "string",
              "format": "uri"
            }
          },
          "release_source_leads": {
            "type": "array",
            "items": {
              "type": "string",
              "format": "uri"
            }
          },
          "research_record": {
            "anyOf": [
              {
                "type": "null"
              },
              {
                "type": "string",
                "pattern": "^research/[a-z0-9-]+\\.txt$"
              }
            ]
          },
          "missing_evidence": {
            "type": "array",
            "minItems": 1,
            "items": {
              "type": "string",
              "minLength": 1
            }
          },
          "alternative_explanations": {
            "type": "array",
            "minItems": 1,
            "items": {
              "type": "string",
              "minLength": 1
            }
          },
          "claim_context": {
            "type": "array",
            "items": {
              "type": "array",
              "minItems": 2,
              "maxItems": 2,
              "items": {
                "type": "string"
              }
            }
          },
          "prior_advisory_product_pattern": {
            "type": "string",
            "minLength": 1
          }
        }
      }
    }
  }
}
